""	"x"
"9"	"What does it feel like to capture the defining moments of Africa's biggest news stories of 2017 on camera? Here, four photographers tell the BBC about their favourite shots from the year.Mike Hutchings is Reuters' chief photographer in southern Africa. Based in Cape Town, he travelled to Zimbabwe in November to document the military takeover which would eventually unseat Robert Mugabe.Earlier in the day, Hutchings had been taking photos outside the parliament while lawmakers were discussing the impeachment of President Mugabe. But the feeling was pretty low key - albeit with a sense of anticipation. After filing those photos, he decided to walk around Unity Square, outside the parliament, one last time. He was looking for a taxi when a colleague phoned him and told him President Mugabe had resigned.  Hutchings ran to the street corner with his camera and heard a huge eruption of cheers and joy from a group of people - that is the moment he captured. I like the energy and the relief of the photo, the photographer explained. It felt really good to be there at that particular time and share that moment.Reuters' chief photographer for north-west Africa, Zohra Bensemra, travelled to a temporary shelter camp in Dallow, Somalia, where she met Zeinab.Like millions of teenagers around the world, Zeinab does her make-up carefully before she goes to school each morning.Unlike millions of teens though, the 14-year-old has already been married - forced into it by her family.Zeinab's family are among almost 900,000 Somalis who have fled their homes, not because of war, but because of a drought and the very real risk of starvation it brought with it.But reaching the aid camp costs money, and Zeinab's dowry would earn the family $1,000 - enough to make the journey.Zeinab refused, however. She ran away and hid in the forest, but eventually she was brought home, locked in a room and forced to marry a man almost four decades older than her.The family, along with Zeinab and her new husband, finally made the journey to the camp in Dallow.It was three days since the couple had married: Zeinab wasted no time. She wanted a divorce - and he wanted his money back.Bensemra first met Zeinab in her shelter in the early morning, when the light would be perfect to capture this teenager's daily routine.She had been saved, in the end, by an Italian aid group, who had agreed to pay the money.Now she was like any other teen - initially reticent to apply her make-up in front of the photographer - getting ready for the school day.Why are you applying make-up to go to school? Bensemra asked.Zeinab replied: I want to remain beautiful.But that is not the image Bensemra treasures of Zeinab. Instead, it is the young girl walking to school, holding her books, walking like star. She had nothing but she still wanted to study - I am happy I met her. Nigerian photographer Akintunde Akinleye went to Maiduguri, in the north-east of the country, to meet the men fighting back against militant group Boko Haram.As a Nigerian currently living in Canada, people often ask Akinleye if the whole of Nigeria is at war.It's just a fraction of the country, he says. Many Nigerians don't even know what's going on there, but it affects everybody in the country. It's a big problem.But Akinleye was desperate to show a different side to the war - a side he captured in this image of 38-year-old Dala Aisami Angwalla, one of 30,000 volunteers with the Civilian Joint Task Force (JTF). Angwalla may have been injured in an ambush, but Akinleye did not want to focus on that. Instead, he asked his subject to gaze into the camera - not as a victim - but as if he was asking the world a question. People think everyone living in the north-west of Nigeria, especially the youth, belong to the insurgency, the photographer explained.But Angwalla said it was important to him to show that this isn't true: He wants to protect his home and his community from Boko Haram. It is not easy. Angwalla says that the Boko Haram members live within the community, alongside the vigilantes.The people who are fighting them know them, they know each of these people who are creating problems, Akinleye says.South African photographer John Wessels travelled to the Kasai region in the Democratic Republic of Congo in August with Oxfam. There's a moment of silence, a moment of quietness and reflection in this photo, Wessels says, pointing to the picture of Anny Mafutani, 30.The young woman, one of thousands to flee her village to escape the fighting, is surrounded by everything she was able to escape with, in a church where displaced people are seeking safety. Her story stayed fresh in Wessels' memory for her determination to survive: Those possessions were already packed, ready, long before the militia actually arrived.It meant when gunshots echoed out across the village, Mafutani and her five children were ready to run for the forest.Her husband was less lucky - he was shot and killed as he tried to escape. She was unable to stop for him.Mafutani and her five children spent months in the forest. There wasn't enough food for them in the package they had prepared so she brought them to this church.And yet, she still wanted to make sure she was camera-perfect. Mafutani left Wessels in awe.She could take five people, survive in the forest, but still wanted to take a scarf and put it on to look as good as possible, he recalls.All four of these photographers were interviewed for a series on BBC World Service Focus on Africa, talking about their photos to illustrate a few of the biggest African news stories of the year. "
"10"	"Citroen's 2CV cars tend to be associated with rural France. But for decades it has been the car of choice for taxi drivers more than 5,000 miles (8,000km) away on the Indian Ocean island of Madagascar.Feno Rafanomezantsoa's father had a 2CV which he bought in 1964. When that broke down, Feno decided to get one of his own. That was in 1987 and he still has it today.Madagascar gained independence from France in 1960, but French cars remain extremely popular.French influence is also seen outside the presidential palace.2CVs have become a symbol of Madagascar.Eddy Rajaonarison La Roche, 26, has been making these souvenirs out of milk cartons since he was 10. It takes him three days to make one.You wait ages for a 2CV and then four come along at once.Menjasoa Anjaraniaiana used to drive another vintage French car - a Renault 4 - but he switched to a 2CV three years ago because he said they were cheaper to maintain.People often choose 2CVs because they don't often break down and when they do, they are cheap and easy to repair.Many Andrianaivoson used to have another car but also switched to a 2CV four months ago because the spare parts are cheaper.There is one complaint - the 2CV can't go that fast. But on the capital Antananarivo's congested roads this doesn't really matter.With such old cars, passengers often find the seats are a bit worse for wear.For some the 2CV is a car for life. All photographs taken by Clare Spencer.We'd like to see your pictures of 2CVs and possibly publish our favourites. Send your 2CV pics that you are particularly proud of to yourpics@bbc.co.uk. You can send an MMS from the UK to 61124. Or if you are contacting us from the rest of the world send it to: +44 (0)7725 100 100. Or upload your photos and video here."
"11"	"A shocking image of environmental crime has been declared the top entry in this year's Wildlife Photographer of the Year (WPY) competition. Taken by South African Brent Stirton, the picture shows the slumped form of a black rhino in Hluhluwe Imfolozi Game Reserve.Poachers killed the animal at night, with a silencer, and then dehorned it. Stirton took the photo as part of an investigation into the illegal trade in rhino products. The photographer visited more than 30 such crime scenes in the course of his probe - experiences he said he found depressing.My first child is going to be born in February; I'm 48. And I think I left it such a long time because I kind of lost faith in a lot of the work we see as photojournalists. You lose faith in humanity to some extent.      Stirton, who collected his award at a gala dinner at London's Natural History Museum, believes this particular piece of butchery was probably carried out by local people, but working to order. The usual practice is to sell the animal's two horns to a middleman. This individual then smuggles the merchandise out of South Africa, most probably through Mozambique, to China or Vietnam. In those Asian countries rhino horn has a street value higher than gold or cocaine. The trade is driven by the misguided belief that horn - the same material as toenails - can cure everything from cancer to kidney stones. Brent Stirton told BBC News: For me to win this, for the jury to acknowledge this kind of picture - it's illustrative that we are living in a different time now, that this is a real issue. The sixth age of extinction is a reality and rhinos are just one of many species that we are losing at a hugely accelerated rate and I am grateful that the jury would choose this image because it gives this issue another platform.  Lewis Blackwell, the chair of judges for WPY, said the rhino image had had a searing impact on his panel: People may be disgusted, they may be horrified - but it draws you in and you want to know more, you want to know the story behind it. And you can't escape it; it confronts you with what's going on in the world.     The rather more peaceful image of a young western lowland gorilla feeding on breadfruit is the subject of the Young Wildlife Photographer of the Year winning entry. This was taken by Daniël Nelson from the Netherlands, who entered the picture in the 15-17-years-old category. The gorilla is about nine years old and is called Caco by the trackers who took the young Dutchman to see the ape in Odzala National Park in the Republic of Congo. Western lowland gorillas are critically endangered. Their numbers are being denuded by illegal hunting for bushmeat, disease (notably the Ebola virus), and habitat loss (to mines and oil-palm plantations). Daniël, who is now 18, said he first became aware of WPY when he was six. It inspired me immediately, and since then my passions in life have revolved around wildlife, photography and conservation.This image is called Contemplation, taken by Peter Delaney (Ireland/South Africa). It wins the Animal Portraits category. It shows a resting chimpanzee on the forest floor in Uganda's Kibale National Park. Peter is from County Wicklow but WPY inspired him to move to Africa to pursue his photography career.Crab surprise is the title of this picture from Justin Gilligan (Australia). It claimed the Invertebrates category. It shows an octopus choosing a meal in a field of giant spider crabs in Mercury Passage off the east coast of Tasmania.Tony Wu (US) calls this The giant gathering. It is the Behaviour: Mammals winner. Tony is a specialist in photographing sperm whales. This huge gathering was captured off Sri Lanka's northeast coast. Very rarely have such scenes been witnessed by cameras.This unusual photo is titled The ice monster. Laurent Ballesta (France) captured the scene in waters off East Antarctica, close to the French Dumont d'Urville scientific base. It shows the underside of an iceberg. It's actually a mosaic of many images stitched together. It won the Earth's Environments category.Palm-oil survivors is the work of Bertie Gekoski (UK/USA) - the winner of the Wildlife Photojournalist: Single image award. It is taken in eastern Sabah, on the island of Borneo. Three generations of Bornean elephants are seen moving across an oil-palm plantation being cleared for replanting. The palm oil industry has reduced and fragmented the animals' habitat. When the animals stray into plantations they often get shot or poisoned, says Bertie. The grip of the gulls, taken by Ekaterina Bee from Italy. Ekaterina is the winner in the 10 years and under category. She got these herring gulls to play for her camera by throwing some bread for them. Ekaterina is just five-and-a-half years old.WPY is one of the most prestigious competitions of its type in world photography. Started in 1964 by what has since become BBC Wildlife Magazine, it has grown in scale and this year accepted 48,000 entries from 92 countries. The current competition is organised by London's Natural History Museum. An exhibition of the best images opens at the South Kensington institution on Friday. Next year's competition starts taking entries from Monday.Jonathan.Amos-INTERNET@bbc.co.uk and follow me on Twitter: @BBCAmos"
"12"	"In our series of letters from African journalists, Elizabeth Ohene looks into recent reports that officials were refusing to register babies with Ghanaian names and only accepting European ones.In Ghana, we have a thing about names and titles. It starts at birth, when there are many naming ceremonies. The first one happens as soon as a child is born and is based on the day of the week he or she arrives. Thus Kwadwo, Komla, Kwaku, Yaw, Kofi, Kwami and Kwasi are the names for males born on Monday, Tuesday, Wednesday, Thursday, Friday, Saturday and Sunday respectively. The female equivalents are Adzoa, Abena, Akua, Yaa or Yawa, Afua, Ama and Akosua. A week after the birth, on the eighth day, we hold an outdooring - a formal ceremony where the parents announce the child's given name.The day name is still used and later in life, it often becomes your middle name. My middle name is Akua because I was born on a Wednesday. For Christians, later on there will be a baptismal ceremony. In the old days, priests used to insist that a child should be given a Christian name - one that can be found in the Bible.The biblical names given to children would be English or German, because the Bible was first brought to Ghana by people from those countries. That is why you'll meet lots of Ghanaians called John, James and Johann. You might also like: Some time later, there would be another ceremony when parents go to register the child at the Births and Deaths Registry. Judging from recent events in Ghana, it would seem that things have been coming to a head at this last naming ceremony. The registry began refusing to register certain names that it deemed inappropriate.This included names like Nana, Naa, Nii, Owula, Togbe, Junior and Prince - all of which are popular in Ghana. The registry said these names were titles, not real names, and that they were intended for chiefs and royals - not ordinary children.Nana's closest equivalent in English is Your Royal Highness. That name, from the Akan language, also exists in the Ga language as Nii for boys and Naa for girls.The name Owula can be translated as Esquire, while the Ewe name, Togbe, literally means grandfather - indicating that the child has been named in honour of their elder.The registry also rejected names where the English name came after the local language name. Writs have been filed in the courts, questions have been asked in parliament and a Minister of State has had to appear in the House to answer questions on the subject. He assured politicians and the people of Ghana that the registry would accept names that they had been refusing to register. The minister added that parents were free to register local language names as first names, and English names as the middle names. This does not mean that people are now free to give their children whatever names they want. The registry will not register your child as Honourable, Excellency, or Your Highness in English - but their Ghanaian equivalents, like Nana, are fine.Their change of heart is good news for Ghana's President Nana Addo Dankwa Akufo-Addo.It would have been very strange if the registry had successfully argued that a new generation of Ghanaians could not be called Nana.More Letters from Africa:The teen rescuing street children in NigeriaWhy some Sudanese back the lecturer who beat his studentsInside Africa's WhatsApp's gated communitiesBraving slavery horrors for European dreamLingering cultural colonialism"
"13"	"In our series of letters from African journalists, novelist and writer Adaobi Tricia Nwaubani looks at how a teenager is transforming the lives of a city's street children.James Okina is quite open about his tearaway teenage days: Shoplifting; stealing from classmates; bunking off.I was, he freely admits, mixing with the wrong crowd.It is a shockingly candid confession - especially when you know that Okina, still just a teenager, is marking his third year heading a charity helping the scores of children who live on the streets of Calabar, capital of Cross River State, in southern Nigeria.It is a transformation he credits two people with: Firstly, a cousin, and secondly, a shabbily-clothed 13-year-old he met at a football match the year he finished secondary school.The boy's name was Frederick and he was one of hundreds of children trying to survive on their own in Calabar.Many come from the nearby camps which house people who fled their homes after Nigeria ceded their oil-rich land in Bakassi to neighbouring Cameroon, following a ruling by the International Court of Justice. Others have been labelled witches, and have been abandoned by their families - a common phenomenon in nearby Akwa Ibom state. But Frederick did, in fact, have a family: He shared a room with his mother. However, she had left eight months earlier, and he was fending for himself.He looked tattered but I was surprised by how intelligent he sounded, Okina recalled.Like many street children, Frederick and his friend Kelvin survived by begging during the day. Then, in the evenings, the 13-year-old friends would perform acrobatics to entertain people in bars at night. Okina began visiting them daily, taking along snacks.The bond we shared, it was really about the conversation we had but not about the food and the money, he said. The more we talked, the more I felt a burden that I have to do more.But Okina did not have much. At the time, he was working in a fashion shop to earn some pocket money while waiting for university admission. His dream was to become an entrepreneur, to one day be known as a real estate mogul.  But he knew these boys needed help, so he approached Inyang Edem, a man in his church, who agreed to donate the fees and other requirements for Frederick's and Kelvin's education. After I got these two kids back to school, I couldn't avoid it. I got myself more and more entangled, he said. Okina befriended some street children who hung out at a junction near his house, spending hours a day chatting with them. One day, as he turned to leave, a child grabbed his hand.Okina assumed the boy wanted to ask for money. But, instead, he said: 'Uncle, please come back again', Okina recalled. There and then, Okina made up his mind to do much more for the children. Knowing that having a structure would enable him to attract more support and to be better organised, he formed Street Priests Inc.  In a time when people tend to hold the government or the clergy responsible for change in society, you can help with what you have from where you are. Nobody has to ordain you. That's why we are called Street Priests, he explained.Using Facebook and his other networks, Okina sourced funds for the education of the next batch of 15 children. He continued visiting street children in other parts of Calabar and, in time, he became so popular among them that they would rush excitedly towards any bus or taxi when they spotted him inside, often making other passengers visibly uncomfortable. Three years later, now a business management student at the University of Calabar, 18-year-old Okina has crowdsourced funds for the education of 215 children, and he has a network of about 50 volunteers. I do not intend to go looking for a job, he said.  But I will build my career around this cause.Adaobi Tricia Nwaubani:His own comfortable life was turned upside down aged eight when his parents divorced. His determination is unsurprising, given the hardships Street Priests has allowed Okina to see up-close: Like the boy who was almost lynched for petty theft; another who lay comatose by the roadside for more than 24 hours after overdosing on drugs; and three who were simultaneously crushed to death by a falling electric pole. Then there was the boy who escaped from so-called ritual killers, his face still baring the mark of the machete with which they had tried to stop him.People say street children are hardened, but I say they are not - not yet, Okina said. This is how street kids become hardened. They see their friends die. They say:  'The world doesn't care, so why should I?'Okina knows what it is like to think no-one cares.His own comfortable life was turned upside down aged eight when his parents divorced. His mother moved out, but his father insisted on keeping Okina, the middle child, and his two brothers.Unhappy, he began spending more and more time outside their home, mixing with what he describes as wrong friends. His grades crashed and he was constantly in trouble - not least for stealing.I knew that I was not cut out for this life but there was nobody to take me out, he said.Society is very quick to label people as bad or wrong. People are not looking for someone to tell them that what they are doing is wrong. They are looking for someone to take them out.But help for Okina was not far away: A cousin from Lagos inspired the young man.He used to reach out to young people in high schools and barracks in Lagos with reading materials. I found that very inspiring, Okina said. He was also very focused and knowledgeable. By listening to and speaking with his cousin, Okina gradually decided to change the path of his own life. He began taking his studies seriously and soon resumed his former place at the top of his class.Many of the people who volunteer with Street Priests today are my former classmates who knew how bad my behaviour was and how radically I changed, he said. They speak to the children about it and my story inspires hope in them.His mother also volunteers, offering free English lessons to the children. His father died last year. Street Priests has expanded its focus from facilitating access to education for street children to include those at risk of ending up in the street, such as those in displaced persons camps. The organisation's mission now includes advocating for the rights of children, educating the public on child rights, and creating a safe space for children. This last has proved the most challenging, as people are usually reluctant to hire out venues for events involving street children.My plan is for us to get a place that we can call our own, he said. In December 2017, Street Priests held an event to show appreciation to outstanding volunteers and other benefactors. Edem, who gave Okina the money for Frederick's and Kelvin's fees, received a special award, and became so emotional that he shed tears. At the time he gave me the money, he had no idea that he was starting something that would become what it is today, Okina said.More Letters from Africa:Why some Sudanese back the lecturer who beat his studentsInside Africa's WhatsApp's gated communitiesBraving slavery horrors for European dreamLingering cultural colonialism"
