"","x"
"165","C++ doesn't have:
PROC - first class nested functions (emulation due to local definitions of class-types, which then could be functors, also new C++11 has lambda functions),
OP and PRIO - definable operator symbols and priorities,
garbage collection (could be emulated with help of smart pointers),
use before define,
formatted transput using complex formatting declarations,
:= - assignment operation symbol (to avoid confusion with equal sign),
array (and slice operations on them, but in layered libraries),
automatic UNIONs,
CASE expressions,
nonlocal GOTO
intuitive declaration syntax due to its origin from C.
ALGOL 68 doesn't have:
public/private struct member access protection,
overloaded procedures (in contrast to operators),
explicit memory deallocation,
forward declarations (use before definition is allowed)
textual preprocessing (e.g."
"166","In the Java computer programming language, an annotation is a form of syntactic metadata that can be added to Java source code. Classes, methods, variables, parameters and packages may be annotated. Like Javadoc tags, Java annotations can be read from source files. Unlike Javadoc tags, Java annotations can also be embedded in and read from class files generated by the compiler. This allows annotations to be retained by Java VM at run-time and read via reflection."
"167","getopt is a C library function used to parse command-line options."
"168","Different Command-line argument parsing methods are used by different programming languages to parse command-line arguments."
"169","ActionScript is an object-oriented programming language originally developed by Macromedia Inc. (later acquired by Adobe Systems). It is a derivation of HyperTalk, the scripting language for HyperCard. It is now a dialect of ECMAScript (meaning it is a superset of the syntax and semantics of the language more widely known as JavaScript), though it originally arose as a sibling, both being influenced by HyperTalk.
ActionScript is used primarily for the development of websites and software targeting the Adobe Flash Player platform, used on Web pages in the form of embedded SWF files.
ActionScript 3 is also used with Adobe AIR system for the development of desktop and mobile applications."
"170","Kotlin is a statically-typed programming language that runs on the Java virtual machine and also can be compiled to JavaScript source code or use the LLVM compiler infrastructure. Its primary development is from a team of JetBrains programmers based in Saint Petersburg, Russia. While the syntax is not compatible with Java, Kotlin is designed to interoperate with Java code and is reliant on Java code from the existing Java Class Library, such as the collections framework. Kotlin uses aggressive type inference to determine the type of values and expressions for which type has been left unstated."
"171","macOS (; previously Mac OS X, then OS X) is a series of graphical operating systems developed and marketed by Apple Inc. since 2001. It is the primary operating system for Apple's Mac family of computers. Within the market of desktop, laptop and home computers, and by web usage, it is the second most widely used desktop OS, after Microsoft Windows.
macOS is the second major series of Macintosh operating systems. The first is colloquially called the ""classic"" Mac OS, which was introduced in 1984, and the final release of which was Mac OS 9 in 1999."
"172","Safari is a web browser developed by Apple based on the WebKit engine. First released in 2003 with Mac OS X Panther, a mobile version has been included in iOS devices since the introduction of the iPhone in 2007. It is the default browser on Apple devices."
"173","Dashboard is an application for Apple Inc.'s macOS operating systems, used as a secondary desktop for hosting mini-applications known as widgets. These are intended to be simple applications that do not take time to launch. Dashboard applications supplied with macOS include a stock ticker, weather report, calculator and notepad; users can create or download their own.
Before Mac OS X 10.7 Lion, when Dashboard is activated, the user's desktop is dimmed and widgets appear in the foreground. Like application windows, they can be moved around, rearranged, deleted, and recreated (so that more than one of the same Widget is open at the same time, possibly with different settings). New widgets can be opened, via an icon bar on the bottom of the layer, loading a list of available apps similar to the iOS homescreen or the macOS Launchpad."
"174","Adobe AIR (formerly Adobe Integrated Runtime) is a cross-platform runtime system developed by Adobe Systems for building desktop applications and mobile applications, programmed using Adobe Flash, ActionScript and optionally Apache Flex. The runtime supports installable applications on Windows, OS X and mobile operating systems including Android, iOS and BlackBerry Tablet OS. It also originally ran on Linux, but support was discontinued as of version 2.6 in 2011.
Adobe AIR is a runtime environment that allows Adobe Flash content and ActionScript 3.0 coders to construct applications and video games that run outside a web browser, and behave as a native application on supported platforms. An application developed for Flash Player or HTML5 and deployed in a browser does not require installation, while AIR applications require installation from an installer file (Windows and OS X) or the appropriate App Store (iOS and Android). AIR applications have unrestricted access to local storage and file systems, while browser-based applications only have access to individual files selected by users.
Adobe AIR internally uses the Flash Player rendering engine and ActionScript 3.0 as the primary programming language. Flash applications must specifically be built for Adobe AIR to use additional features provided, such as multi-touch, file system integration, native client extensions, integration with Taskbar or Dock, and access to accelerometer and GPS devices."
"175","iOS (formerly iPhone OS) is a mobile operating system created and developed by Apple Inc. exclusively for its hardware. It is the operating system that presently powers many of the company's mobile devices, including the iPhone, iPad, and iPod Touch. It is the second most popular mobile operating system globally after Android.
Originally unveiled in 2007 for the iPhone, iOS has been extended to support other Apple devices such as the iPod Touch (September 2007) and the iPad (January 2010). As of January 2017, Apple's App Store contains more than 2.2 million iOS applications, 1 million of which are native for iPads."
"176","Corona is a software development kit (SDK) developed by Corona Labs Inc. Corona allows software programmers to build 2D mobile applications for iOS, Android, and Kindle, desktop applications for Windows and OS X, and connected TV applications for Apple TV and Android TV.
Corona uses integrated Lua layered on top of C++/OpenGL to build graphic applications. The software has two operational modes: the Corona Simulator and Corona Native. With the Corona Simulator, you build your app directly from the Corona Simulator."
"177","Thoughts on Flash is an open letter published by Steve Jobs, co-founder and then-chief executive officer of Apple Inc., on April 29, 2010. The letter criticized Adobe Systems' Flash platform and outlined reasons why the technology would not be allowed on the company's iOS hardware products, specifically iPhone, iPod Touch, and iPad. The letter drew immediate attention, with Adobe's CEO Shantanu Narayen firing back at Apple, stating that one of the issues in the criticism was due to Apple's own operating system rather than Flash technology, and that other criticism was false. At the time, various media publications had different opinions on the topic, with some citing business motivations rather than technological, hypocrisy in the letter despite agreeing with Jobs, and outright accusations of lying. However, retroactively, more publications have agreed with Jobs, with notable mentions of poor performance of Flash on Android devices.
That month, Apple had revised its iPhone Developer Agreement, adding new developer restrictions, particularly that only ""approved"" programming languages would be allowed on App Store."
"178","A compiler is computer software that transforms computer code written in one programming language (the source language) into another programming language (the target language). Compilers are a type of translator that support digital devices, primarily computers. The name compiler is primarily used for programs that translate source code from a high-level programming language to a lower level language (e.g., assembly language, object code, or machine code) to create an executable program.
However, there are many different types of compilers. If the compiled program can run on a computer whose CPU or operating system is different from the one on which the compiler runs, the compiler is a cross-compiler. A bootstrap compiler is written in the language that it intends to compile."
"179","In compiler design, static single assignment form (often abbreviated as SSA form or simply SSA) is a property of an intermediate representation (IR), which requires that each variable is assigned exactly once, and every variable is defined before it is used. Existing variables in the original IR are split into versions, new variables typically indicated by the original name with a subscript in textbooks, so that every definition gets its own version. In SSA form, use-def chains are explicit and each contains a single element.
SSA was proposed by Barry K. Rosen, Mark N. Wegman, and F. Kenneth Zadeck in 1988. Ron Cytron, Jeanne Ferrante and the previous three researchers at IBM developed an algorithm that can compute the SSA form efficiently.
One can expect to find SSA in a compiler for Fortran or C, whereas in functional language compilers, such as those for Scheme, ML and Haskell, continuation-passing style (CPS) is generally used. SSA is formally equivalent to a well-behaved subset of CPS excluding non-local control flow, which does not occur when CPS is used as intermediate representation."
"180","Standard Portable Intermediate Representation (SPIR) is an intermediate language for parallel compute and graphics by Khronos Group, originally developed for use with OpenCL. The current version, SPIR-V, was announced in March 2015."
"181","In programming languages, closures (also lexical closures or function closures) are techniques for implementing lexically scoped name binding in languages with first-class functions. Operationally, a closure is a record storing a function together with an environment: a mapping associating each free variable of the function (variables that are used locally, but defined in an enclosing scope) with the value or reference to which the name was bound when the closure was created. A closure—unlike a plain function—allows the function to access those captured variables through the closure's copies of their values or references, even when the function is invoked outside their scope.
Example. The following program fragment defines a higher-order function startAt with a parameter x and a nested function incrementBy. The nested function incrementBy has access to x, because incrementBy is in the lexical scope of x, even though x is not local to incrementBy. The function startAt returns a closure containing a copy of the value of x or a copy of the reference to x from this invocation of startAt, and the function incrementBy, which adds the value of y to the value of x:

function startAt(x)
   function incrementBy(y)
       return x + y
   return incrementBy

variable closure1 = startAt(1)
variable closure2 = startAt(5)

Note that, as startAt returns a function, the variables closure1 and closure2 are of function type."
"182","In computer programming, a nested function (or nested procedure or subroutine) is a function which is defined within another function, the enclosing function. Due to simple recursive scope rules, a nested function is itself invisible outside of its immediately enclosing function, but can see (access) all local objects (data, functions, types, etc.) of its immediately enclosing function as well as of any function(s) which, in turn, encloses that function. The nesting is theoretically possible to unlimited depth, although only a few levels are normally used in practical programs.
Nested functions are used in many approaches to structured programming, including early ones, such as ALGOL, Simula 67 and Pascal, and also in many modern dynamic languages and functional languages."
"183","A cross compiler is a compiler capable of creating executable code for a platform other than the one on which the compiler is running. For example, a compiler that runs on a Windows 7 PC but generates code that runs on Android smartphone is a cross compiler.
A cross compiler is necessary to compile for multiple platforms from one machine. A platform could be infeasible for a compiler to run on, such as for the microcontroller of an embedded system because those systems contain no operating system. In paravirtualization one machine runs many operating systems, and a cross compiler could generate an executable for each of them from one main source.
Cross compilers are not to be confused with source-to-source compilers. A cross compiler is for cross-platform software development of binary code, while a source-to-source compiler translates from one programming language to another in text code."
"184","DBX is a source-level debugger found primarily on Solaris, AIX, IRIX, Tru64 UNIX, Linux and BSD operating systems. It provides symbolic debugging for programs written in C, C++, Pascal, FORTRAN and Java. Useful features include stepping through programs one source line or machine instruction at a time."
"185","The Portable C Compiler (also known as pcc or sometimes pccm - portable C compiler machine) is an early compiler for the C programming language written by Stephen C. Johnson of Bell Labs in the mid-1970s, based in part on ideas proposed by Alan Snyder in 1973, and ""distributed as the C compiler by Bell Labs... with the blessing of Dennis Ritchie.""
One of the first compilers that could easily be adapted to output code for different computer architectures, the compiler had a long life span. It debuted in Seventh Edition Unix and shipped with BSD Unix until the release of 4.4BSD in 1994, when it was replaced by the GNU C Compiler. It was very influential in its day, so much so that at the beginning of the 1980s, the majority of C compilers were based on it."
"186","KDevelop is a free and open-source integrated development environment (IDE) for Unix-like computer operating systems and Microsoft Windows. It provides editing, navigation and debugging features for several programming languages, and integration with build automation and version-control systems, using a plugin-based architecture.
KDevelop 5 has parser backends for C, C++, Objective-C, OpenCL and JavaScript/QML, with plugins supporting PHP, Python 3 and Ruby. Basic syntax highlighting and code folding are available for dozens of other source-code and markup formats, but without semantic analysis.
KDevelop is part of the KDE project, and is based on KDE Frameworks and Qt."
"187","This article contains a list of text editors with features specific to the PHP scripting language."
"188","CodeLite is a free and open-source IDE for the C, C++, PHP, and JavaScript (Node.js) programming languages."
"189","Qt ( ""cute"") is a cross-platform application framework that is used for developing application software that can be run on various software and hardware platforms with little or no change in the underlying codebase, while still being a native application with native capabilities and speed. Qt is currently being developed both by The Qt Company, a publicly listed company, and the Qt Project under open-source governance, involving individual developers and firms working to advance Qt."
"190","A graphical user interface builder (or GUI builder), also known as GUI designer, is a software development tool that simplifies the creation of GUIs by allowing the designer to arrange graphical control elements (often called widgets) using a drag-and-drop WYSIWYG editor. Without a GUI builder, a GUI must be built by manually specifying each widget's parameters in source-code, with no visual feedback until the program is run.
User interfaces are commonly programmed using an event-driven architecture, so GUI builders also simplify creating event-driven code. This supporting code connects widgets with the outgoing and incoming events that trigger the functions providing the application logic.
Some graphical user interface builders, such as e.g. Glade Interface Designer, automatically generate all the source code for a graphical control element."
"191","MonoDevelop (also known as Xamarin Studio) is an open source integrated development environment for Linux, macOS, and Windows. Its primary focus is development of projects that use Mono and .NET frameworks. MonoDevelop integrates features similar to those of NetBeans and Microsoft Visual Studio, such as automatic code completion, source control, a graphical user interface (GUI) and Web designer. MonoDevelop integrates a Gtk# GUI designer called Stetic. It supports Boo, C, C++, C#, CIL, D, F#, Java, Oxygene, Vala, and Visual Basic.NET.
MonoDevelop can be used on Windows, macOS and Linux."
"192","V-Play is a cross-platform development tool, based on the Qt framework. It can be used to create mobile apps or 2D games. V-Play apps and games are supported on iOS, Android, Windows Phone, embedded devices and desktop devices. V-Play developers use QML, JavaScript and C++ to create mobile apps and games.
Apps and games built with V-Play use a single code base and work across multiple platforms and screen resolutions."
"193","Cheney's algorithm, first described in a 1970 ACM paper by C.J. Cheney, is a stop and copy method of tracing garbage collection in computer software systems. In this scheme, the heap is divided into two equal halves, only one of which is in use at any one time. Garbage collection is performed by copying live objects from one semispace (the from-space) to the other (the to-space), which then becomes the new heap. The entire old heap is then discarded in one piece. It is an improvement on the previous stop and copy technique.
Cheney's algorithm reclaims items as follows:
Object references on the stack. Object references on the stack are checked."
"194","Dangling pointers and wild pointers in computer programming are pointers that do not point to a valid object of the appropriate type. These are special cases of memory safety violations. More generally, dangling references and wild references are references that do not resolve to a valid destination, and include such phenomena as link rot on the internet.
Dangling pointers arise during object destruction, when an object that has an incoming reference is deleted or deallocated, without modifying the value of the pointer, so that the pointer still points to the memory location of the deallocated memory. The system may reallocate the previously freed memory, and if the program then dereferences the (now) dangling pointer, unpredictable behavior may result, as the memory may now contain completely different data. If the program writes to memory referenced by a dangling pointer, a silent corruption of unrelated data may result, leading to subtle bugs that can be extremely difficult to find."
"195","In computer science, a memory leak is a type of resource leak that occurs when a computer program incorrectly manages memory allocations in such a way that memory which is no longer needed is not released. In object-oriented programming, a memory leak may happen when an object is stored in memory but cannot be accessed by the running code. A memory leak has symptoms similar to a number of other problems and generally can only be diagnosed by a programmer with access to the program's source code.
A space leak occurs when a computer program uses more memory than necessary. In contrast to memory leaks, where the leaked memory is never released, the memory consumed by a space leak is released, but later than expected."
"196","C dynamic memory allocation refers to performing manual memory management for dynamic memory allocation in the C programming language via a group of functions in the C standard library, namely malloc, realloc, calloc and free.
The C++ programming language includes these functions for compatibility with C; however, the operators new and delete provide similar functionality and are recommended by that language's authors.
Many different implementations of the actual memory allocation mechanism, used by malloc, are available."
"197","mtrace is the memory debugger included in the GNU C Library."
"198","In object-oriented programming, a finalizer or finalize method is a special method that performs finalization, generally some form of cleanup. A finalizer is executed during object destruction, prior to the object being deallocated, and is complementary to an initializer, which is executed during object creation, following allocation. Finalizers are strongly discouraged by some, due to difficulty in proper use and the complexity they add, and alternatives are suggested instead, primarily the dispose pattern – see problems with finalizers.
The term ""finalizer"" is primarily used in object-oriented languages that use garbage collection, of which the archetype is Smalltalk. This is contrasted with a ""destructor"", which is a method called for finalization in languages with deterministic object lifetimes, archetypically C++. These are generally exclusive – a language will have either finalizers (if garbage collected) or destructors (if deterministic), but in rare cases a language may have both, as in C++/CLI and D, and in case of reference counting (instead of tracing garbage collection), terminology varies."
"199","In the C++ programming language, a copy constructor is a special constructor for creating a new object as a copy of an existing object. Copy constructors are the standard way of copying objects in C++, as opposed to cloning, and have C++-specific nuances.
The first argument of such a constructor is a reference to an object of the same type as is being constructed (const or non-const), which might be followed by parameters of any type (all having default values).
Normally the compiler automatically creates a copy constructor for each class (known as an implicit copy constructor) but for special cases the programmer creates the copy constructor, known as a user-defined copy constructor. In such cases, the compiler does not create one."
"200","Resource acquisition is initialization (RAII) is a programming idiom used in several object-oriented languages. In RAII, holding a resource is a class invariant, and is tied to object lifetime: resource allocation (or acquisition) is done during object creation (specifically initialization), by the constructor, while resource deallocation (release) is done during object destruction (specifically finalization), by the destructor. Thus the resource is guaranteed to be held between when initialization finishes and finalization starts (holding the resources is a class invariant), and to be held only when the object is alive. Thus if there are no object leaks, there are no resource leaks.
RAII is associated most prominently with C++ where it originated, but also D, Ada, Vala, and Rust. The technique was developed for exception-safe resource management in C++ during 1984–89, primarily by Bjarne Stroustrup and Andrew Koenig, and the term itself was coined by Stroustrup."
"201","auto_ptr was a class template available in the C++ Standard Library (declared in the <memory> header file) that provided some basic RAII features for C++ raw pointers. It has been replaced by the unique_ptr class.
The auto_ptr template class describes an object that stores a pointer to a single allocated object that ensures that the object to which it points gets destroyed automatically when control leaves a scope.
The C++11 standard made auto_ptr deprecated, replacing it with the unique_ptr class template. auto_ptr was fully removed in C++17. For shared ownership, the shared_ptr template class can be used."
"202","Common Lisp (CL) is a dialect of the Lisp programming language, published in ANSI standard document ANSI INCITS 226-1994 (R2004) (formerly X3.226-1994 (R1999)). The Common Lisp HyperSpec, a hyperlinked HTML version, has been derived from the ANSI Common Lisp standard.
The Common Lisp language was developed as a standardized and improved successor of Maclisp. By the early 1980s several groups were already at work on diverse successors to MacLisp: Lisp Machine Lisp (aka ZetaLisp), Spice Lisp, NIL and S-1 Lisp. Common Lisp sought to unify, standardise, and extend the features of these MacLisp dialects. Common Lisp is not an implementation, but rather a language specification."
"203","In object-oriented programming and software engineering, the visitor design pattern is a way of separating an algorithm from an object structure on which it operates. A practical result of this separation is the ability to add new operations to existent object structures without modifying the structures. It is one way to follow the open/closed principle.
In essence, the visitor allows adding new virtual functions to a family of classes, without modifying the classes. Instead, a visitor class is created that implements all of the appropriate specializations of the virtual function."
