"","x"
"45","In software engineering, inversion of control (IoC) is a design principle in which custom-written portions of a computer program receive the flow of control from a generic framework. A software architecture with this design inverts control as compared to traditional procedural programming: in traditional programming, the custom code that expresses the purpose of the program calls into reusable libraries to take care of generic tasks, but with inversion of control, it is the framework that calls into the custom, or task-specific, code.
Inversion of control is used to increase modularity of the program and make it extensible, and has applications in object-oriented programming and other programming paradigms. The term was used by Michael Mattsson in a thesis, taken from there by Stefano Mazzocchi and popularized by him in 1999 in a now-defunct Apache Software Foundation project Avalon, then further popularized in 2004 by Robert C. Martin and Martin Fowler.
The term is related to, but different from, the dependency inversion principle, which concerns itself with decoupling dependencies between high-level and low-level layers through shared abstractions."
"46","In software engineering, a plain old Java object (POJO) is an ordinary Java object, not bound by any special restriction and not requiring any class path. The term was coined by Martin Fowler, Rebecca Parsons and Josh MacKenzie in September 2000: 

""We wondered why people were so against using regular objects in their systems and concluded that it was because simple objects lacked a fancy name. So we gave them one, and it's caught on very nicely.""

The term ""POJO"" initially denoted a Java object which does not follow any of the major Java object models, conventions, or frameworks; nowadays ""POJO"" may be used as an acronym for ""Plain Old JavaScript Object"" as well, in which case the term denotes a JavaScript object of similar pedigree.
The term continues the pattern of older terms for technologies that do not use fancy new features, such as POTS (Plain Old Telephone Service) in telephony and Pod (Plain Old Documentation) in Perl. The equivalent to POJO on the .NET framework is Plain Old CLR Object (POCO)."
"47","The Spring Framework is an application framework and inversion of control container for the Java platform. The framework's core features can be used by any Java application, but there are extensions for building web applications on top of the Java EE (Enterprise Edition) platform. Although the framework does not impose any specific programming model, it has become popular in the Java community as an addition to, or even replacement for the Enterprise JavaBeans (EJB) model."
"48","Google Guice (pronounced ""juice"") is an open source software framework for the Java platform released by Google under the Apache License. It provides support for dependency injection using annotations to configure Java objects. Dependency injection is a design pattern whose core principle is to separate behavior from dependency resolution.
Guice allows implementation classes to be bound programmatically to an interface, then injected into constructors, methods or fields using an @Inject annotation."
"49","In computer programming, lazy initialization is the tactic of delaying the creation of an object, the calculation of a value, or some other expensive process until the first time it is needed. It is a kind of lazy evaluation that refers specifically to the instantiation of objects or other resources.
This is typically accomplished by augmenting an accessor method (or property getter) to check whether a private member, acting as a cache, has already been initialized. If it has, it is returned straight away. If not, a new instance is created, placed into the member variable, and returned to the caller just-in-time for its first use.
If objects have properties that are rarely used, this can improve startup speed."
"50","In computer programming, a parameter (often called formal parameter or formal argument) is a special kind of variable, used in a subroutine to refer to one of the pieces of data provided as input to the subroutine. These pieces of data are the values of the arguments (often called actual arguments or actual parameters) with which the subroutine is going to be called/invoked. An ordered list of parameters is usually included in the definition of a subroutine, so that, each time the subroutine is called, its arguments for that call are evaluated, and the resulting values can be assigned to the corresponding parameters.
Unlike argument in usual mathematical usage, the argument in computer science is thus the actual input expression passed/supplied to a function, procedure, or routine in the invokation/call statement, whereas the parameter is the variable inside the implementation of the subroutine. For example, if one defines the add subroutine as def add(x, y): return x + y, then x, y are parameters, while if this is called as add(2, 3), then 2, 3 are the arguments. Note that variables (and expressions thereof) from the calling context can be arguments: if the subroutine is called as a = 2; b = 3; add(a, b) then the variables a, b are the arguments, not the values 2, 3."
"51","C++11 is a version of the standard for the programming language C++. It was approved by International Organization for Standardization (ISO) on 12 August 2011, replacing C++03, superseded by C++14 on 18 August 2014 and later, by C++17. The name follows the tradition of naming language versions by the publication year of the specification, though it was formerly named C++0x because it was expected to be published before 2010.
Although one of the design goals was to prefer changes to the libraries over changes to the core language, C++11 does make several additions to the core language. Areas of the core language that were significantly improved include multithreading support, generic programming support, uniform initialization, and performance. Significant changes were also made to the C++ Standard Library, incorporating most of the C++ Technical Report 1 (TR1) libraries, except the library of mathematical special functions.
C++11 was published as ISO/IEC 14882:2011 in September 2011 and is available for a fee."
"52","In computer programming, variadic templates are templates that take a variable number of arguments."
"53","In class-based object-oriented programming, a constructor (abbreviation: ctor) is a special type of subroutine called to create an object. It prepares the new object for use, often accepting arguments that the constructor uses to set required member variables.
A constructor resembles an instance method, but it differs from a method in that it has no explicit return type, it is not implicitly inherited and it usually has different rules for scope modifiers. Constructors often have the same name as the declaring class. They have the task of initializing the object's data members and of establishing the invariant of the class, failing if the invariant is invalid. A properly written constructor leaves the resulting object in a valid state."
"54","The syntax of the Java programming language is the set of rules defining how a Java program is written and interpreted.
The syntax is mostly derived from C and C++. Unlike C++, in Java there are no global functions or variables, but there are data members which are also regarded as global variables. All code belongs to classes and all values are objects. The only exception is the primitive types, which are not represented by a class instance for performance reasons (though can be automatically converted to objects and vice versa via autoboxing)."
"55","typedef is a reserved keyword in the C and C++ programming languages. It is used to create an alias name for another data type. As such, it is often used to simplify the syntax of declaring complex data structures consisting of struct and union types, but is just as common in providing specific descriptive type names for integer data types of varying lengths."
"56","Generics are a facility of generic programming that were added to the Java programming language in 2004 within version J2SE 5.0. They were designed to extend Java's type system to allow “a type or method to operate on objects of various types while providing compile-time type safety”. The aspect compile-time type safety was not fully achieved, since it was shown in 2016 that it is not guaranteed in all cases.
The Java collections framework supports generics to specify the type of objects stored in a collection instance.
In 1998, Gilad Bracha, Martin Odersky, David Stoutamire and Philip Wadler created Generic Java, an extension to the Java language to support generic types."
"57","In computer programming, an entry point is where control is transferred from the operating system to a computer program, at which place the processor enters a program or a code fragment and execution begins. In some operating systems or programming languages, the initial entry is not part of the program but of the runtime library, in which case the runtime library initializes the program and then the runtime library enters the program. In other cases, the program may call the runtime library before doing anything when it is entered for the first time, and, after the runtime library returns, the actual code of the program begins to execute. This marks the transition from load time (and dynamic link time, if present) to run time.
In simple layouts, programs begin their execution at the beginning, which is common in scripting languages, simple binary executable formats, and boot loaders. In other cases, the entry point is at some other fixed point, which is some memory address than can be an absolute address or relative address (offset).
Alternatively, execution of a program can begin at a named point, either with a conventional name defined by the programming language or operating system, or at a caller-specified name."
"58","Ceylon is an object-oriented, strongly statically typed programming language with an emphasis on immutability, created by Red Hat. Ceylon programs run on the Java virtual machine (JVM), and can be compiled to JavaScript."
"59","Dashcode was a software application created by Apple Inc. that was included with Mac OS X Leopard and facilitates the development of widgets for Dashboard."
"60","The iOS SDK (Software Development Kit) (formerly iPhone SDK) is a software development kit developed by Apple Inc. The kit allows for the development of mobile apps on Apple's iOS operating system.
While originally developing iPhone prior to its unveiling in 2007, Apple's then-CEO Steve Jobs did not intend to let third-party developers build native apps for iOS, instead directing them to make web applications for the Safari web browser. However, backlash from developers prompted the company to reconsider, with Jobs announcing in October 2007 that Apple would have a software development kit available for developers by February 2008. The SDK was released on March 6, 2008.
The SDK is a free download for users of Mac personal computers. It is not available for Microsoft Windows PCs."
"61","An Intermediate representation (IR) is the data structure or code used internally by a compiler or virtual machine to represent source code. An IR is designed to be conducive for further processing, such as optimization and translation. A ""good"" IR must be accurate – capable of representing the source code without loss of information – and independent of any particular source or target language. An IR may take one of several forms: an in-memory data structure, or a special tuple- or stack-based code readable by the program. In the latter case it is also called an intermediate language.
A canonical example is found in most modern compilers, where the linear human-readable text representing a program is transformed into an intermediate graph structure that allows flow analysis and re-arrangement before creating a sequence of actual CPU instructions."
"62","Blocks are a non-standard extension added by Apple Inc. to Clang's implementations of the C, C++, and Objective-C programming languages that uses a lambda expression-like syntax to create closures within these languages. Blocks are supported for programs developed for Mac OS X 10.6+ and iOS 4.0+, although third-party runtimes allow use on Mac OS X 10.5 and iOS 2.2+ and non-Apple systems.
Apple designed blocks with the explicit goal of making it easier to write programs for the Grand Central Dispatch threading architecture, although it is independent of that architecture and can be used in much the same way as closures in other languages. Apple has implemented blocks both in their own branch of the GNU Compiler Collection and in the upstream Clang LLVM compiler front end. Language runtime library support for blocks is also available as part of the LLVM project."
"63","This page is intended to list all current compilers, compiler generators, interpreters, translators, tool foundations, assemblers, automatable command line interfaces (shells), etc."
"64","Code::Blocks is a free, open-source cross-platform IDE that supports multiple compilers including GCC, Clang and Visual C++. It is developed in C++ using wxWidgets as the GUI toolkit. Using a plugin architecture, its capabilities and features are defined by the provided plugins. Currently, Code::Blocks is oriented towards C, C++, and Fortran."
"65","Qt Creator is a cross-platform C++, JavaScript and QML integrated development environment which is part of the SDK for the Qt GUI application development framework. It includes a visual debugger and an integrated GUI layout and forms designer. The editor's features include syntax highlighting and autocompletion. Qt Creator uses the C++ compiler from the GNU Compiler Collection on Linux and FreeBSD. On Windows it can use MinGW or MSVC with the default install and can also use Microsoft Console Debugger when compiled from source code."
"66","In computer science, reference counting is a technique of storing the number of references, pointers, or handles to a resource such as an object, block of memory, disk space or other resource."
"67","This is a comparison of the programming languages Java and C++."
"68","In computer programming, tracing garbage collection is a form of automatic memory management that consists of determining which objects should be deallocated (""garbage collected"") by tracing which objects are reachable by a chain of references from certain ""root"" objects, and considering the rest as ""garbage"" and collecting them."
"69","In computer science, the Boehm–Demers–Weiser garbage collector, often simply known as Boehm GC, is a conservative garbage collector for C and C++."
"70","In computer science, manual memory management refers to the usage of manual instructions by the programmer to identify and deallocate unused objects, or garbage. Up until the mid-1990s, the majority of programming languages used in industry supported manual memory management, though garbage collection has existed since 1959, when it was introduced with Lisp. Today, however, languages with garbage collection such as Java are increasingly popular and the languages Objective-C and Swift provide similar functionality through Automatic Reference Counting."
"71","In computer science, a smart pointer is an abstract data type that simulates a pointer while providing added features, such as automatic memory management or bounds checking. Such features are intended to reduce bugs caused by the misuse of pointers, while retaining efficiency. Smart pointers typically keep track of the memory they point to, and may also be used to manage other resources, such as network connections and file handles. Smart pointers originated in the programming language C++.
Pointer misuse can be a major source of bugs. Smart pointers prevent most situations of memory leaks by making the memory deallocation automatic."
"72","In computer science, unreachable memory is a block of memory allocated dynamically where the program that allocated the memory no longer has any reachable pointer that refers to it. Similarly, an unreachable object is a dynamically allocated object that has no reachable reference to it. Informally, unreachable memory is dynamic memory that the program can not reach directly, nor get to by starting at an object it can reach directly, and then following a chain of pointer references.
In dynamic memory allocation implementations that employ a garbage collector, objects are reclaimed after they become unreachable. The garbage collector is able to determine if an object is reachable; any object that is determined to no longer be reachable can be deallocated. Many programming languages (for example, Java, C#, D, Dylan) use automatic garbage collection.
In contrast, when memory becomes unreachable in dynamic memory allocation implementations that require explicit deallocation, the memory can no longer be explicitly deallocated."
"73","Dynamic programming language, in computer science, is a class of high-level programming languages which, at runtime, execute many common programming behaviors that static programming languages perform during compilation. These behaviors could include extension of the program, by adding new code, by extending objects and definitions, or by modifying the type system. Although similar behaviours can be emulated in nearly any language, with varying degrees of difficulty, complexity and performance costs, dynamic languages provide direct tools to make use of them. Many of these features were first implemented as native features in the Lisp programming language.
Most dynamic languages are also dynamically typed, but not all are."
"74","In computing, type introspection is the ability of a program to examine the type or properties of an object at runtime. Some programming languages possess this capability.
Introspection should not be confused with reflection, which goes a step further and is the ability for a program to manipulate the values, meta-data, properties and/or functions of an object at runtime. Some programming languages - e.g."
"75","In some programming languages, eval is a function which evaluates a string as though it were an expression and returns a result; in others, it executes multiple lines of code as though they had been included instead of the line including the eval. The input to eval is not necessarily a string; it may be structured representation of code, such as an abstract syntax tree (like Lisp forms), or of special type such as code (as in Python)."
"76","In object-oriented programming (OOP), a factory is an object for creating other objects – formally a factory is a function or method that returns objects of a varying prototype or class from some method call, which is assumed to be ""new"". More broadly, a subroutine that returns a ""new"" object may be referred to as a ""factory"", as in factory method or factory function."
"77","This is a list of terms found in object-oriented programming."
"78","A virtual method table (VMT), virtual function table, virtual call table, dispatch table, vtable, or vftable is a mechanism used in a programming language to support dynamic dispatch (or run-time method binding).
Whenever a class defines a virtual function (or method), most compilers add a hidden member variable to the class which points to an array of pointers to (virtual) functions called the virtual method table (VMT or Vtable). These pointers are used at runtime to invoke the appropriate function implementations, because at compile time it may not yet be known if the base function is to be called or a derived one implemented by a class that inherits from the base class.
Suppose a program contains several classes in an inheritance hierarchy: a superclass, Cat, and two subclasses, HouseCat and Lion. Class Cat defines a virtual function named speak, so its subclasses may provide an appropriate implementation (e.g. either meow or roar).
When the program calls the speak function on a Cat reference (which can refer to an instance of Cat, or an instance of HouseCat or Lion), the code must be able to determine which implementation of the function the call should be dispatched to. This depends on the actual class of the object, not its declared class Cat."
"79","Inline caching is an optimization technique employed by some language runtimes, and first developed for Smalltalk. The goal of inline caching is to speed up runtime method binding by remembering the results of a previous method lookup directly at the call site."
"80","PyGTK is a set of Python wrappers for the GTK+ graphical user interface library. PyGTK is free software and licensed under the LGPL. It is analogous to PyQt/PySide and wxPython, the Python wrappers for Qt and wxWidgets, respectively. Its original author is GNOME developer James Henstridge. There are six people in the core development team, with various other people who have submitted patches and bug reports. PyGTK has been selected as the environment of choice for applications running on One Laptop Per Child systems.
PyGTK will be phased out with the transition to GTK+ version 3 and be replaced with PyGObject, which uses GObject Introspection to generate bindings for Python and other languages on the fly."
"81","GLib is a bundle of three (formerly five) low-level system libraries written in C and developed mainly by GNOME. GLib's code was separated from GTK+, so it can be used by software other than GNOME and has been developed in parallel ever since."
"82","Vala is an object-oriented programming language with a self-hosting compiler that generates C code and uses the GObject system.
Vala is syntactically similar to C# and includes several features such as: anonymous functions, signals, properties, generics, assisted memory management, exception handling, type inference, and foreach statements. Its developers Jürg Billeter and Raffaele Sandrini aim to bring these features to the plain C runtime with little overhead and no special runtime support by targeting the GObject object system. Rather than compiling directly to machine code or assembly language, it compiles to a lower level intermediate language. It source-to-source compiles to C, which is then compiled with a C compiler for a given platform, such as GCC.
For memory management, the GObject system provides reference counting. In C, a programmer must manually manage adding and removing references, but in Vala, managing such reference counts is automated if a programmer uses the language's built-in reference types rather than plain pointers.
Using functionality from native code libraries requires writing vapi files, defining the library interfacing."
"83","Genie is a modern, general-purpose high-level programming language in active development since 2008. It was designed as an alternative, simpler and cleaner dialect for the Vala compiler, while preserving the same functionality of the Vala language. Genie uses the same compiler and libraries as Vala; the two can indeed be used alongside each other. The differences are only syntactic.
Genie's syntax is derived from numerous modern languages like Python, Boo, D and Delphi. In the vein of Python, Genie uses indentation rather than curly brackets to delimit blocks.
Like Vala, Genie uses the GObject type system to create classes and interfaces declared in Genie source code, without imposing additional runtime requirements (i.e., unlike Python, Java or C#, it does not require a virtual machine).
Genie allows access to C libraries, especially those based in GObject (like GTK+), without using a different application binary interface (ABI)."
"84","As shown in the table below, GTK+ has a range of bindings for various languages that implement some or all of its feature set.
GObject (GOB) was initially written as a central component of GTK+, but outsourced into GLib.
GObject Introspection is a middleware layer between C libraries (using GObject) and language bindings, e.g."
"85","NeXT (later NeXT Computer and NeXT Software) was an American computer and software company founded in 1985 by Apple Computer co-founder Steve Jobs. Based in Redwood City, California, the company developed and manufactured a series of computer workstations intended for the higher education and business markets. NeXT was founded by Jobs after he left Apple, along with several co-workers. NeXT introduced the first NeXT Computer in 1988, and the smaller NeXTstation in 1990. The NeXT computers experienced relatively limited sales, with estimates of about 50,000 units shipped in total."
