"","x"
"86","Core Foundation (also called CF) is a C application programming interface (API) in macOS & iOS, and is a mix of low-level routines and wrapper functions. Apple releases most of it as an open source project called CFLite that can be used to write cross-platform applications for macOS, Linux, and Windows; a third-party open-source implementation called OpenCFLite also exists. Most Core Foundation routines follow a certain naming convention that deal with opaque objects, for example CFDictionaryRef for functions whose names begin with CFDictionary, and these objects are often reference counted (manually) through CFRetain and CFRelease. Internally, Core Foundation forms the base of the types in the Objective-C standard library as well.
The most prevalent use of Core Foundation is for passing its own primitive types for data, including raw bytes, Unicode strings, numbers, calendar dates, and UUIDs, as well as collections such as arrays, sets, and dictionaries, to numerous macOS C routines, primarily those that are GUI-related. At the operating system level Core Foundation also provides standardized application preferences management through CFPropertyList, bundle handling, run loops, interprocess communication through CFMachPort and CFNotificationCenter, and a basic graphical user interface message dialog through CFUserNotification.
Other parts of the API include utility routines and wrappers around existing APIs for ease of use."
"87","The family of Macintosh operating systems developed by Apple Inc. includes the graphical user interface-based operating systems it has designed for use with its Macintosh series of personal computers since 1984, as well as the related system software it once created for compatible third-party systems.
In 1984, Apple debuted the operating system that is now known as the ""Classic"" Mac OS with its release of the original Macintosh System Software. The system, rebranded ""Mac OS"" in 1996, was preinstalled on every Macintosh until 2002 and offered on Macintosh clones for a short time in the 1990s. Noted for its ease of use, it was also criticized for its lack of modern technologies compared to its competitors.
The current Mac operating system is macOS, originally named ""Mac OS X"" until 2012 and then ""OS X"" until 2016. Developed between 1997 and 2001 after Apple's purchase of NeXT, Mac OS X brought an entirely new architecture based on NeXTSTEP, a Unix system, that eliminated many of the technical challenges that the classic Mac OS faced."
"88","The Dock is a prominent feature of the graphical user interface of the macOS operating system. It is used to launch applications and to switch between running applications. The Dock is also a prominent feature of macOS's predecessor NeXTSTEP and OpenStep operating systems. The earliest known implementations of a dock are found in operating systems such as RISC OS and NeXTSTEP. iOS has its own version of the Dock for iPhone, iPod Touch and iPad.
Apple applied for a US patent for the design of the Dock in 1999 and was granted the patent in October 2008, nine years later. Applications can be added to and removed from the Dock by drag and drop, except for the Finder, which is a permanent fixture as the leftmost item (or topmost if the Dock is configured to be vertical)."
"89","A menu bar is a graphical control element which contains drop-down menus.
The menu bar's purpose is to supply a common housing for window- or application-specific menus which provide access to such functions as opening files, interacting with an application, or displaying help documentation or manuals."
"90","Gorm or GORM may refer to:"
"91","GNUstep Renaissance is a development framework that reads XML descriptions of graphical user interfaces from an application bundle and converts them into native widgets and connections at runtime under either GNUstep or Mac OS X.
GNUstep Renaissance was written by Nicola Pero as an alternative to the NIB and gorm files used by Interface Builder and Gorm, respectively. Unlike the aforementioned formats, Renaissance can generate interfaces that can be run without modification on either GNUstep or Mac OS X. It also uses a feature called AutoLayout, which means that localized strings do not have to be manually resized.
As of January 2006, GNUstep Renaissance is beta software. A graphical frontend to Renaissance does not yet exist."
"92","This article provides a list of widget toolkits (also known as GUI frameworks), used to construct the graphical user interface (GUI) of programs, organized by their relationships with various operating systems."
"93","Core Data is an object graph and persistence framework provided by Apple in the macOS and iOS operating systems. It was introduced in Mac OS X 10.4 Tiger and iOS with iPhone SDK 3.0. It allows data organized by the relational entity–attribute model to be serialized into XML, binary, or SQLite stores. The data can be manipulated using higher level objects representing entities and their relationships. Core Data manages the serialized version, providing object lifecycle and object graph management, including persistence."
"94","Mach () is an operating system kernel developed at Carnegie Mellon University to support operating system research, primarily distributed and parallel computing. Mach is often mentioned as one of the earliest examples of a microkernel. However, not all versions of Mach are microkernels. Mach's derivatives are the basis of the modern operating system kernels in GNU Hurd and Apple's operating systems macOS, iOS, tvOS, and watchOS.
The project at Carnegie Mellon ran from 1985 to 1994, ending with Mach 3.0, which is a true microkernel. Mach was developed as a replacement for the kernel in the BSD version of Unix, so no new operating system would have to be designed around it."
"95","Darwin is an open-source Unix operating system first released by Apple Inc. in 2000. It is composed of code developed by Apple, as well as code derived from NeXTSTEP, BSD, Mach, and other free software projects.
Darwin forms the core set of components upon which macOS (previously OS X and Mac OS X), iOS, watchOS, and tvOS are based."
"96","MkLinux is an open source computer operating system started by the Open Software Foundation Research Institute and Apple Computer in February 1996 to port Linux to the PowerPC platform, and Macintosh computers."
"97",""
"98","Carbon is one of Apple Inc.'s C-based application programming interfaces (APIs) for the Macintosh operating system. Carbon provided a good degree of backward compatibility for programs that ran on Mac OS 8 and 9. Developers could use the Carbon APIs to port their ""classic"" Mac software to the Mac OS X platform with far less effort than a port to the entirely different Cocoa system, which originated in OPENSTEP.
Carbon was an important part of Apple's strategy for bringing Mac OS X to market, offering a path for quick porting of existing software applications, as well as a means of shipping applications that would run on either Mac OS X or the classic Mac OS. As the market has increasingly moved to the Cocoa-based frameworks, especially after the release of iOS, the need for a porting library was diluted."
"99","Copland is an unreleased operating system prototype for Apple Macintosh computers of the late 1990s, intended to be released as the modern System 8 successor to the aging but venerable System 7. It introduced protected memory, preemptive multitasking, and a number of new underlying operating system features, while retaining compatibility with existing Mac applications. Copland's planned successor, codenamed Gershwin, was intended to add advanced features such as application-level multithreading.
Across a protracted development period of several years, previews of Copland garnered much press that introduced the layperson Macintosh audience to basic concepts of modern operating system design such as object orientation, crash-proofing, and multitasking. The project was Apple's trigger to cofound several industry-wide standards and consortiums for next-generation operating system development, such as OpenDoc and Taligent.
Copland reached Developer Release beta testing status before its cancellation in August 1996. Instead, Apple released a much more legacy-oriented Mac OS 8 in 1997, followed by Mac OS 9's architectural improvements in 1999, and then Mac OS X became Apple's next generation operating system release in 2001."
"100","A monolithic kernel is an operating system architecture where the entire operating system is working in kernel space and is alone in supervisor mode. The monolithic model differs from other operating system architectures (such as the microkernel architecture) in that it alone defines a high-level virtual interface over computer hardware. A set of primitives or system calls implement all operating system services such as process management, concurrency, and memory management."
"101","The architecture of Windows NT, a line of operating systems produced and sold by Microsoft, is a layered design that consists of two main components, user mode and kernel mode. It is a preemptive, reentrant operating system, which has been designed to work with uniprocessor and symmetrical multi processor (SMP)-based computers. To process input/output (I/O) requests, they use packet-driven I/O, which utilizes I/O request packets (IRPs) and asynchronous I/O. Starting with Windows XP, Microsoft began making 64-bit versions of Windows available; before this, these operating systems only existed in 32-bit versions.
Programs and subsystems in user mode are limited in terms of to what system resources they have access, while the kernel mode has unrestricted access to the system memory and external devices. The Windows NT kernel is known as a hybrid kernel. The architecture comprises a simple kernel, hardware abstraction layer (HAL), drivers, and a range of services (collectively named Executive), which all exist in kernel mode.
User mode in Windows NT is made of subsystems capable of passing I/O requests to the appropriate kernel mode device drivers by using the I/O manager."
"102","An operating system (OS) is system software that manages computer hardware and software resources and provides common services for computer programs.
Time-sharing operating systems schedule tasks for efficient use of the system and may also include accounting software for cost allocation of processor time, mass storage, printing, and other resources.
For hardware functions such as input and output and memory allocation, the operating system acts as an intermediary between programs and the computer hardware, although the application code is usually executed directly by the hardware and frequently makes system calls to an OS function or is interrupted by it. Operating systems are found on many devices that contain a computer –  from cellular phones and video game consoles to web servers and supercomputers.
The dominant desktop operating system is Microsoft Windows with a market share of around 82.74%. macOS by Apple Inc. is in second place (13.23%), and the varieties of Linux are collectively in third place (1.57%). In the mobile (smartphone and tablet combined) sector, use in 2017 is up to 70% of Google's Android and according to third quarter 2016 data, Android on smartphones is dominant with 87.5 percent and a growth rate 10.3 percent per year, followed by Apple's iOS with 12.1 percent and a per year decrease in market share of 5.2 percent, while other operating systems amount to just 0.3 percent."
"103","In computing, cross-platform software (also multi-platform software or platform-independent software) is computer software that is implemented on multiple computing platforms. Cross-platform software may be divided into two types; one requires individual building or compilation for each platform that it supports, and the other one can be directly run on any platform without special preparation, e.g., software written in an interpreted language or pre-compiled portable bytecode for which the interpreters or run-time packages are common or standard components of all platforms.
For examples, a cross-platform application may run on Microsoft Windows on the x86 architecture, Linux on the x86 architecture and macOS on either the PowerPC or x86-based Apple Macintosh systems. Cross-platform programs may run on as many as all existing platforms, or on as few as two platforms."
"104","In software engineering, a compatibility layer is an interface that allows binaries for a legacy or foreign system to run on a host system. This translates system calls for the foreign system into native system calls for the host system. With some libraries for the foreign system, this will often be sufficient to run foreign binaries on the host system."
"105","This article provides non-exhaustive lists of Java SE Java virtual machines (JVMs). It does not include a large number of Java ME vendors. Note that Java EE runs on the standard Java SE JVM but that some vendors specialize in providing a modified JVM optimized for Java EE applications. A large amount of Java development work takes place on Windows, Solaris, Linux and FreeBSD, primarily with the Oracle JVMs."
"106",""
"107","Bytecode, also termed portable code or p-code, is a form of instruction set designed for efficient execution by a software interpreter. Unlike human-readable source code, bytecodes are compact numeric codes, constants, and references (normally numeric addresses) that encode the result of compiler parsing and semantic analysis of things like type, scope, and nesting depths of program objects.
The name bytecode stems from instruction sets that have one-byte opcodes followed by optional parameters. Intermediate representations such as bytecode may be output by programming language implementations to ease interpretation, or it may be used to reduce hardware and operating system dependence by allowing the same code to run cross-platform, on different devices. Bytecode may often be either directly executed on a virtual machine (a p-code machine i.e., interpreter), or it may be further compiled into machine code for better performance.
Since bytecode instructions are processed by software, they may be arbitrarily complex, but are nonetheless often akin to traditional hardware instructions: virtual stack machines are the most common, but virtual register machines have been built also."
"108","The GNU Compiler for Java (GCJ) is a free compiler for the Java programming language. It was part of the GNU Compiler Collection for over ten years but as of 2017 it is no longer maintained and will not be part of future releases.
GCJ compiles Java source code to Java Virtual Machine bytecode or to machine code for a number of CPU architectures."
"109","In computing, a binding from a programming language to a library or operating system service is an application programming interface (API) providing glue code to use that library or service in a given programming language.
Binding generally refers to a mapping of one thing to another. In the context of software libraries, bindings are wrapper libraries that bridge two programming languages, so that a library written for one language can be used in another language. Many software libraries are written in system programming languages such as C or C++. To use such libraries from another language, usually of higher-level, such as Java, Common Lisp, Python, or Lua, a binding to the library must be created in that language, possibly requiring recompiling the language's code, depending on the amount of modification needed. However, most languages offer a foreign function interface, such as Python's and OCaml's ctypes, and Embeddable Common Lisp's cffi and uffi.
For example, Python bindings are used when an extant C library, written for some purpose, is to be used from Python."
"110","A foreign function interface (FFI) is a mechanism by which a program written in one programming language can call routines or make use of services written in another."
"111","Java Native Access (JNA) is a community-developed library that provides Java programs easy access to native shared libraries without using the Java Native Interface. JNA's design aims to provide native access in a natural way with a minimum of effort."
"112","Delphi is an integrated development environment (IDE) for rapid application development of desktop, mobile, web, and console software, developed Embarcadero Technologies. It's also an event driven language. Delphi's compilers use their own Object Pascal dialect of Pascal and generate native code for Microsoft Windows, macOS (IA-32 only), iOS, Android and Linux (x64 only). Since 2016, there has been new releases of Delphi every six months, with new platforms being added approximately every second release.
Delphi includes a code editor, a visual designer, an integrated debugger, a source code control component, and support for third-party plugins. The code editor features Code Insight (code completion), Error Insight (real-time error-checking), and refactoring."
"113","Object Pascal refers to a branch of object-oriented derivatives of Pascal, mostly known as the primary programming language of Delphi."
"114","Oxygene (formerly known as Chrome) is a programming language developed by RemObjects Software for Microsoft's Common Language Infrastructure, the Java Platform and Cocoa. Oxygene is Object Pascal-based, but also has influences from C#, Eiffel, Java, F# and other languages.
Compared to the now deprecated Delphi.NET, Oxygene does not emphasize total backward compatibility, but is designed to be a ""reinvention"" of the language, be a good citizen on the managed development platforms, and leverage all the features and technologies provided by the .NET and Java runtimes.
Oxygene is commercial product, and offers full integration into Microsoft's Visual Studio IDE on Windows, as well as its own IDE, Fire for use on macOS. The command line compiler is available free. Oxygene is one of four languages supported by the underlying Elements Compiler toolchain, next to C#, Swift and Java).
From 2008 to 2012, RemObjects Software has licensed its compiler and IDE technology to Embarcadero to be used in their Embarcadero Prism product. Starting in the Fall of 2011, Oxygene became available in two separate editions, with the second edition adding support for the Java and Android runtimes. Starting with the release of XE4, Embarcadero Prism is no longer part of the RAD Studio SKU. Numerous support and upgrade paths for Prism customers exist to migrate to Oxygene."
"115","Mono is a free and open-source project led by Xamarin, a subsidiary of Microsoft (formerly by Novell and originally by Ximian), and the .NET Foundation, to create an Ecma standard-compliant, .NET Framework-compatible set of tools including, among others, a C# compiler and a Common Language Runtime. The logo of Mono is a stylized monkey's face, mono being Spanish for monkey.
The stated purpose of Mono is not only to be able to run Microsoft .NET applications cross-platform, but also to bring better development tools to Linux developers. Mono can be run on many software systems including Android, most Linux distributions, BSD, macOS, Windows, Solaris, and even some game consoles such as PlayStation 3, Wii, and Xbox 360.
The Mono project has been controversial within the open-source community, as it implements portions of .NET Framework that may be covered by Microsoft patents. Although standardized portions of .NET Framework are covered under Microsoft's ""Open Specification Promise""—a covenant stating that Microsoft will not assert its patents against implementations of its specifications under certain conditions—other portions are not, which led to concerns that the Mono project could become the target of patent infringement lawsuits."
"116","Extensible Application Markup Language (XAML,  ( listen)) is a declarative XML based language developed by Microsoft that is used for initializing structured values and objects. It is available under Microsoft's Open Specification Promise. The acronym originally stood for Extensible Avalon Markup Language, Avalon being the code-name for Windows Presentation Foundation (WPF).
XAML is used extensively in .NET Framework 3.0 & .NET Framework 4.0 technologies, particularly Windows Presentation Foundation (WPF), Silverlight, Windows Workflow Foundation (WF), Windows Runtime XAML Framework and Windows Store apps. In WPF, XAML forms a user interface markup language to define UI elements, data binding, events, and other features. In WF, workflows can be defined using XAML. XAML can also be used in Silverlight applications, Windows Phone apps and Windows Store apps.
XAML elements map directly to Common Language Runtime object instances, while XAML attributes map to Common Language Runtime properties and events on those objects."
"117","In Microsoft Windows applications programming, OLE Automation (later renamed to simply Automation) is an inter-process communication mechanism created by Microsoft. It is based on a subset of Component Object Model (COM) that was intended for use by scripting languages – originally Visual Basic – but now is used by several languages on Windows. All automation objects are required to implement the IDispatch interface. It provides an infrastructure whereby applications called automation controllers can access and manipulate (i.e. set properties of or call methods on) shared automation objects that are exported by other applications."
"118","Component Object Model (COM) is a binary-interface standard for software components introduced by Microsoft in 1993. It is used to enable inter-process communication object creation in a large range of programming languages. COM is the basis for several other Microsoft technologies and frameworks, including OLE, OLE Automation, Browser Helper Object, ActiveX, COM+, DCOM, the Windows shell, DirectX, UMDF and Windows Runtime. The essence of COM is a language-neutral way of implementing objects that can be used in environments different from the one in which they were created, even across machine boundaries. For well-authored components, COM allows reuse of objects with no knowledge of their internal implementation, as it forces component implementers to provide well-defined interfaces that are separated from the implementation."
"119","'Windows Runtime XAML Framework' (code name ""Jupiter"") is a user interface API that is part of the Windows Runtime (WinRT) programming model that forms the backbone of Windows Store apps (formerly known as Metro-style or Immersive) for the Windows 8, Windows 8.1 and Windows Phone 8.1 operating systems."
"120","In computer science, type safety is the extent to which a programming language discourages or prevents type errors. A type error is erroneous or undesirable program behaviour caused by a discrepancy between differing data types for the program's constants, variables, and methods (functions), e.g., treating an integer (int) as a floating-point number (float). Type safety is sometimes alternatively considered to be a property of a computer program rather than the language in which that program is written; that is, some languages have type-safe facilities that can be circumvented by programmers who adopt practices that exhibit poor type safety. The formal type-theoretic definition of type safety is considerably stronger than what is understood by most programmers.
Type enforcement can be static, catching potential errors at compile time, or dynamic, associating type information with values at run-time and consulting them as needed to detect imminent errors, or a combination of both.
The behaviors classified as type errors by a given programming language are usually those that result from attempts to perform operations on values that are not of the appropriate data type. This classification is partly based on opinion; it may imply that any operation not leading to program crashes, security flaws or other obvious failures is legitimate and need not be considered an error, or it may imply that any contravention of the programmer's explicit intent (as communicated via typing annotations) to be erroneous and not ""type-safe"".
In the context of static (compile-time) type systems, type safety usually involves (among other things) a guarantee that the eventual value of any expression will be a legitimate member of that expression's static type."
"121","In computer programming, a variable or scalar is a storage location (identified by a memory address) paired with an associated symbolic name (an identifier), which contains some known or unknown quantity of information referred to as a value. The variable name is the usual way to reference the stored value, in addition to referring to the variable itself, depending on the context. This separation of name and content allows the name to be used independently of the exact information it represents. The identifier in computer source code can be bound to a value during run time, and the value of the variable may thus change during the course of program execution.
Variables in programming may not directly correspond to the concept of variables in mathematics. The latter is abstract, having no reference to a physical object such as storage location."
