"","x"
"1","Swift is a general-purpose, multi-paradigm, compiled programming language developed by Apple Inc. for iOS, macOS, watchOS, tvOS, and Linux. Swift is designed to work with Apple's Cocoa and Cocoa Touch frameworks and the large body of existing Objective-C (ObjC) code written for Apple products. It is built with the open source LLVM compiler framework and has been included in Xcode since version 6. On platforms other than Linux, it uses the Objective-C runtime library which allows C, Objective-C, C++ and Swift code to run within one program.
Apple intended Swift to support many core concepts associated with Objective-C, notably dynamic dispatch, widespread late binding, extensible programming and similar features, but ""safer"" (easier to catch software bugs); Swift has features addressing some common programming errors like null pointers and provides syntactic sugar to help avoid the pyramid of doom."
"2","Cocoa is Apple's native object-oriented application programming interface (API) for their operating system macOS.
For iOS, tvOS, and watchOS, a similar API exists, named Cocoa Touch, which includes gesture recognition, animation, and a different set of graphical control elements. It is used in applications for Apple devices such as iPhone, iPad, iPod Touch, Apple TV, and Apple Watch.
Cocoa consists of the Foundation Kit, Application Kit, and Core Data frameworks, as included by the Cocoa.h header file, and the libraries and frameworks included by those, such as the C standard library and the Objective-C runtime.
Cocoa applications are typically developed using the development tools provided by Apple, specifically Xcode (formerly Project Builder) and Interface Builder, using the languages Objective-C or Swift. However, the Cocoa programming environment can be accessed using other tools, such as Clozure CL, LispWorks, Object Pascal, Python, Perl, Ruby, and AppleScript with the aid of bridge mechanisms such as PasCocoa, PyObjC, CamelBones, RubyCocoa, and a D/Objective-C Bridge. A Ruby language implementation named MacRuby, which removes the need for a bridge mechanism, was formerly developed by Apple, while Nu is a Lisp-like language that can be used with Cocoa with no bridge. It is also possible to write Objective-C Cocoa programs in a simple text editor and build it manually with GNU Compiler Collection (GCC) or clang from the command line or from a makefile.
For end-users, Cocoa applications are those written using the Cocoa programming environment."
"3","In object-oriented computer programming, a null object is an object with no referenced value or with defined neutral (""null"") behavior. The null object design pattern describes the uses of such objects and their behavior (or lack thereof)."
"4","Chris Lattner (born 1978) is an American software developer, best known as the main author of LLVM and related projects, such as the compiler Clang and the programming language Swift. He works at Google Brain, following a brief stint at Tesla, Inc. as Vice President of Autopilot Software. Prior to that, he worked at Apple Inc."
"5","Automatic Reference Counting (ARC) is a memory management feature of the Clang compiler providing automatic reference counting for the Objective-C and Swift programming languages. At compile time, it inserts into the object code messages retain and release which increase and decrease the reference count at run time, marking for deallocation those objects when the number of references to them reaches zero.
ARC differs from tracing garbage collection in that there is no background process that deallocates the objects asynchronously at runtime. Unlike garbage collection, ARC does not handle reference cycles automatically. This means that as long as there are ""strong"" references to an object, it will not be deallocated. Strong cross-references can accordingly create deadlocks and memory leaks."
"6","Objective-C is a general-purpose, object-oriented programming language that adds Smalltalk-style messaging to the C programming language. It was the main programming language used by Apple for the OS X and iOS operating systems, and their respective application programming interfaces (APIs) Cocoa and Cocoa Touch prior to the introduction of Swift.
The programming language Objective-C was originally developed in the early 1980s. It was selected as the main language used by NeXT for its NeXTSTEP operating system, from which OS X and iOS are derived. Portable Objective-C programs that do not use the Cocoa or Cocoa Touch libraries, or those using parts that may be ported or reimplemented for other systems, can also be compiled for any system supported by GNU Compiler Collection (GCC) or Clang.
Objective-C source code 'implementation' program files usually have .m filename extensions, while Objective-C 'header/interface' files have .h extensions, the same as C header files."
"7","OpenStep is an object-oriented application programming interface (API) specification for a legacy object-oriented operating system, with the basic goal of offering a NeXTSTEP-like environment on a non-NeXTSTEP operating system. OpenStep was principally developed by NeXT with Sun Microsystems, to allow NeXTSTEP (like) development on Sun's operating systems, specifically Solaris."
"8","GNUstep is a free software implementation of the Cocoa (formerly OpenStep) Objective-C frameworks, widget toolkit, and application development tools for Unix-like operating systems and Microsoft Windows. It is part of the GNU Project.
GNUstep features a cross-platform, object-oriented IDE. Apart from the default Objective-C interface, GNUstep also has bindings for Java, Ruby, Guile and Scheme. The GNUstep developers track some additions to Apple's Cocoa to remain compatible. The roots of the GNUstep application interface are the same as the roots of Cocoa: NeXTSTEP and OpenStep."
"9","The architecture of macOS describes the layers of the operating system that is the culmination of Apple Inc.'s decade-long search and development process to replace the classic Mac OS."
"10","In computer science, bridging describes systems that map the runtime behaviour of different programming languages so they can share common resources. They are often used to allow ""foreign"" languages to operate a host platform's native object libraries, translating data and state across the two sides of the bridge. Bridging contrasts with ""embedding"" systems that allow limited interaction through a black box mechanism, where state sharing is limited or non-existent.
Apple Inc. has made heavy use of bridging on several occasions, notably in early versions of Mac OS X which bridged to older ""classic"" systems using the Carbon system as well as Java. Microsoft's Common Language Runtime, introduced with the .NET Framework, was designed to be multi-language from the start, and avoided the need for extensive bridging solutions."
"11","In programming languages and type theory, polymorphism (from Greek πολύς, polys, ""many, much"" and μορφή, morphē, ""form, shape"") is the provision of a single interface to entities of different types. A polymorphic type is one whose operations can also be applied to values of some other type, or types. There are several fundamentally different kinds of polymorphism:
Ad hoc polymorphism: when a function denotes different and potentially heterogeneous implementations depending on a limited range of individually specified types and combinations. Ad hoc polymorphism is supported in many languages using function overloading.
Parametric polymorphism: when code is written without mention of any specific type and thus can be used transparently with any number of new types. In the object-oriented programming community, this is often known as generics or generic programming."
"12","In software engineering, dependency injection is a technique whereby one object supplies the dependencies of another object. A dependency is an object that can be used (a service). An injection is the passing of a dependency to a dependent object (a client) that would use it. The service is made part of the client's state. Passing the service to the client, rather than allowing a client to build or find the service, is the fundamental requirement of the pattern.
This fundamental requirement means that using values (services) produced within the class from new or static methods is prohibited."
"13","In the area of mathematical logic and computer science known as type theory, a unit type is a type that allows only one value (and thus can hold no information). The carrier (underlying set) associated with a unit type can be any singleton set. There is an isomorphism between any two such sets, so it is customary to talk about the unit type and ignore the details of its value. One may also regard the unit type as the type of 0-tuples, i.e. the product of no types.
The unit type is the terminal object in the category of types and typed functions."
"14","This article describes the syntax of the C# programming language."
"15","In software engineering, the module pattern is a design pattern used to implement the concept of software modules, defined by modular programming, in a programming language with incomplete direct support for the concept.
This pattern can be implemented in several ways depending on the host programming language, such as the singleton design pattern, object-oriented static members in a class and procedural global functions."
"16","Xcode is an integrated development environment (IDE) for macOS containing a suite of software development tools developed by Apple for developing software for macOS, iOS, watchOS, and tvOS. First released in 2003, the latest stable release is version 9.2 and is available via the Mac App Store free of charge for macOS High Sierra and macOS Sierra users."
"17","The LLVM compiler infrastructure project is a ""collection of modular and reusable compiler and toolchain technologies"" used to develop compiler front ends and back ends.
LLVM is written in C++ and is designed for compile-time, link-time, run-time, and ""idle-time"" optimization of programs written in arbitrary programming languages. Originally implemented for C and C++, the language-agnostic design of LLVM has since spawned a wide variety of front ends: languages with compilers that use LLVM include ActionScript, Ada, C#, Common Lisp, Crystal, CUDA, D, Delphi, Fortran, Halide, Haskell, Java bytecode, Julia, Kotlin, Lua, Objective-C, OpenGL Shading Language, Pony, Python, R, Ruby, Rust, Scala, Swift, and Xojo.
The LLVM project started in 2000 at the University of Illinois at Urbana–Champaign, under the direction of Vikram Adve and Chris Lattner. LLVM was originally developed as a research infrastructure to investigate dynamic compilation techniques for static and dynamic programming languages. LLVM was released under the University of Illinois/NCSA Open Source License, a permissive free software licence. In 2005, Apple Inc."
"18","Clang  is a compiler front end for the programming languages C, C++, Objective-C, Objective-C++, OpenMP, OpenCL, and CUDA. It uses LLVM as its back end and has been part of the LLVM release cycle since LLVM 2.6.
It is designed to act as a drop-in replacement for the GNU Compiler Collection, supporting most of its compilation flags and unofficial language extensions. Its contributors include Apple, Microsoft, Google, ARM, Sony, Intel and Advanced Micro Devices (AMD)."
"19","The LLDB Debugger (LLDB) is a software debugger."
"20","In computer science, garbage collection (GC) is a form of automatic memory management. The garbage collector, or just collector, attempts to reclaim garbage, or memory occupied by objects that are no longer in use by the program. Garbage collection was invented by John McCarthy around 1959 to simplify manual memory management in Lisp.
Garbage collection is often portrayed as the opposite of manual memory management, which requires the programmer to specify which objects to deallocate and return to the memory system. However, many systems use a combination of approaches, including other techniques such as stack allocation and region inference. Like other memory management techniques, garbage collection may take a significant proportion of total processing time in a program and, as a result, can have significant influence on performance."
"21","In computer programming, a weak reference is a reference that does not protect the referenced object from collection by a garbage collector, unlike a strong reference. An object referenced only by weak references – meaning ""every chain of references that reaches the object includes at least one weak reference as a link"" – is considered weakly reachable, and can be treated as unreachable and so may be collected at any time."
"22","In computer science, reflection is the ability of a computer program to examine, introspect, and modify its own structure and behavior at runtime."
"23","In computer science, dynamic dispatch is the process of selecting which implementation of a polymorphic operation (method or function) to call at run time. It is commonly employed in, and considered a prime characteristic of, object-oriented programming (OOP) languages and systems.
Object-oriented systems model a problem as a set of interacting objects that enact operations referred to by name. Polymorphism is the phenomenon wherein somewhat interchangeable objects each expose an operation of the same name but possibly differing in behavior. As an example, a File object and a Database object both have a StoreRecord method that can be used to write a personnel record to storage. Their implementations differ."
"24","The GLib Object System, or GObject, is a free software library providing a portable object system and transparent cross-language interoperability. GObject is designed for use both directly in C programs to provide object-oriented C-based APIs and through bindings to other languages to provide transparent cross-language interoperability, e.g."
"25","NeXTSTEP is a discontinued object-oriented, multitasking operating system based on UNIX. It was developed by NeXT Computer in the late 1980s and early 1990s and was initially used for its range of proprietary workstation computers such as the NeXTcube and later ported to several other computer architectures.
Although relatively unsuccessful at the time, it attracted interest from computer scientists and researchers. It was used as the original platform for the development of the Electronic AppWrapper, the first commercial electronic software distribution catalog to collectively manage encryption and provide digital rights for application software and digital media, a forerunner of the modern ""app store"" concept. It was also the platform on which Tim Berners-Lee created the first web browser."
"26","Portable Distributed Objects (PDO) is an application programming interface (API) for creating object-oriented code that can be executed remotely on a network of computers. It was created by NeXT Computer, Inc. using their OpenStep system, whose use of Objective-C made the package very easy to write. It was characterized by its very light weight and high speed in comparison to similar systems such as CORBA.
Versions of PDO were available for Solaris, HP-UX and all versions of the OPENSTEP system. A version that worked with Microsoft OLE was also available called D'OLE, allowing distributed code written using PDO on any platform to be presented on Microsoft systems as if they were local OLE objects.
PDO was one of a number of distributed object systems created in the early 1990s, a design model where ""front end"" applications on GUI-based microcomputers would call code running on mainframe and minicomputers for their processing and data storage."
"27","The Foundation Kit, or just Foundation for short, is an Objective-C framework in the OpenStep specification. It provides basic classes such as wrapper classes and data structure classes."
"28","Mac OS X Server 1.0, released on March 16, 1999, is the first operating system released into the retail market by Apple Computer based on NeXT technology. It was the final release of the product code-named Rhapsody, which was an interim combination of the OpenStep system (Mach OS and OpenStep API) and Mac OS 8.
Although Mac OS X Server 1.0's graphical ""look and feel"" was a variation of the Platinum theme from Mac OS 8, its infrastructure is based on the OPENSTEP (and thus, NeXTSTEP) operating system instead of the classic Mac OS. The resulting product gave users a preview of the operating system that was to become Mac OS X (now referred to as macOS)."
"29","Window Maker is a free and open source window manager for the X Window System, allowing graphical applications to be run on Unix-like operating-systems. It is designed to emulate NeXTSTEP's GUI as an OpenStep-compatible environment."
"30","Gorm (Graphical Object Relationship Modeller) is a graphical user interface builder application. It is part of the developer tools of GNUstep. Gorm is the equivalent of Interface Builder that was originally found on NeXTSTEP, then OPENSTEP, and finally on Mac OS X.
Gorm and Project Center represent the heart of the suite for GNUstep. Gorm follows Interface Builder so closely that using tutorials written for the latter is possible without much hassle and thus brings the power of Interface Builder to the open source world, being part of the GNU project.
Gorm allows developers to quickly create graphical applications and to design every little aspect of the application's user interface. The developer can drag and drop all types of objects such as menus, buttons, tables, lists and browsers into the interface."
"31","Interface Builder is a software development application for Apple's Mac OS X operating system. It is part of Xcode (formerly Project Builder), the Apple Developer Connection developer's toolset. Interface Builder allows Cocoa and Carbon developers to create interfaces for applications using a graphical user interface. The resulting interface is stored as a .nib file, short for NeXT Interface Builder, or more recently, as a .xib file.
Interface Builder is descended from the NeXTSTEP development software of the same name. A version of Interface Builder is also used in the development of OpenStep software, and a very similar tool called Gorm exists for GNUstep."
"32","XNU is the computer operating system kernel developed at Apple Inc. since December 1996 for use in the macOS operating system and released as free and open-source software as part of the Darwin operating system. It is also used as the kernel for the iOS, tvOS, and watchOS operating systems."
"33","Rhapsody was the code name given to Apple Computer's next-generation operating system during the period of its development between Apple's purchase of NeXT in late 1996 and the announcement of Mac OS X (now macOS) in 1998. At first more than an operating system, Rhapsody represented a new strategy for Apple, who intended the operating system to run on x86-based PCs, DEC Alpha workstations, as well as PowerPC-based Macintosh hardware. In addition, the underlying API frameworks would be ported to run natively on Microsoft Windows NT. Eventually the non-Apple platforms were dropped and later versions consisted primarily of the OPENSTEP operating system ported to the Power Macintosh along with a new GUI to make it appear more Mac-like. Several existing ""classic"" Mac OS technologies were also ported to Rhapsody, including QuickTime and AppleSearch."
"34","A hybrid kernel is an operating system kernel architecture that attempts to combine aspects and benefits of microkernel and monolithic kernel architectures used in computer operating systems."
"35","A computing platform is the environment in which a piece of software is executed. It may be the hardware or the operating system (OS), even a web browser or other underlying software, as long as the program code is executed in it. Computing platforms have different abstraction levels, including a computer architecture, an OS, or runtime libraries. A computing platform is the stage on which computer programs can run.
A platform can be seen both as a constraint on the software development process, in that different platforms provide different functionality and restrictions; and as an assistance to the development process, in that they provide low-level functionality ready-made."
"36","libffi is a foreign function interface library. It provides a C programming language interface for calling natively compiled functions given information about the target function at run time instead of compile time. It also implements the opposite functionality: libffi can produce a pointer to a function that can accept and decode any combination of arguments defined at run time.
libffi is most often used as a bridging technology between compiled and interpreted language implementations."
"37","RemObjects Software is an American software company founded in 2002 by Alessandro Federici and Marc Hoffman."
"38","Windows Runtime (WinRT) is a platform-agnostic application architecture first introduced in Windows 8 and Windows Server 2012 in 2012. WinRT supports development in C++/CX (Component Extensions, a language based on C++), JavaScript-TypeScript, and the managed code languages C# and Visual Basic .NET (VB.NET). WinRT applications natively support both the x86 and ARM processors, and run inside a sandboxed environment to allow greater security and stability. WinRT components are designed with interoperability between multiple languages and APIs in mind, including native, managed and scripting languages.
Windows Phone 8.1 uses a version of the Windows Runtime named the Windows Phone Runtime."
"39","In programming languages, a type system is a set of rules that assigns a property called type to the various constructs of a computer program, such as variables, expressions, functions or modules. These types formalize and enforce the otherwise implicit categories the programmer uses for data structures and components (e.g. ""string"", ""array of float"", ""function returning boolean""). The main purpose of a type system is to reduce possibilities for bugs in computer programs by defining interfaces between different parts of a computer program, and then checking that the parts have been connected in a consistent way. This checking can happen statically (at compile time), dynamically (at run time), or as a combination of static and dynamic checking."
"40","In programming language theory, subtyping (also subtype polymorphism or inclusion polymorphism) is a form of type polymorphism in which a subtype is a datatype that is related to another datatype (the supertype) by some notion of substitutability, meaning that program elements, typically subroutines or functions, written to operate on elements of the supertype can also operate on elements of the subtype. If S is a subtype of T, the subtyping relation is often written S <: T, to mean that any term of type S can be safely used in a context where a term of type T is expected. The precise semantics of subtyping crucially depends on the particulars of what ""safely used in a context where"" means in a given programming language. The type system of a programming language essentially defines its own subtyping relation, which may well be trivial .
Due to the subtyping relation, a term may belong to more than one type. Subtyping is therefore a form of type polymorphism."
"41","In programming languages, ad-hoc polymorphism is a kind of polymorphism in which polymorphic functions can be applied to arguments of different types, because a polymorphic function can denote a number of distinct and potentially heterogeneous implementations depending on the type of argument(s) to which it is applied. It is also known as function overloading or operator overloading. The term ad hoc in this context is not intended to be pejorative; it refers simply to the fact that this type of polymorphism is not a fundamental feature of the type system. This is in contrast to parametric polymorphism, in which polymorphic functions are written without mention of any specific type, and can thus apply a single abstract implementation to any number of types in a transparent way."
"42","In programming languages and type theory, parametric polymorphism is a way to make a language more expressive, while still maintaining full static type-safety. Using parametric polymorphism, a function or a data type can be written generically so that it can handle values identically without depending on their type. Such functions and data types are called generic functions and generic datatypes respectively and form the basis of generic programming.
For example, a function append that joins two lists can be constructed so that it does not care about the type of elements: it can append lists of integers, lists of real numbers, lists of strings, and so on. Let the type variable a denote the type of elements in the lists. Then append can be typed
forall a."
"43","In type theory, bounded quantification (also bounded polymorphism or constrained genericity) refers to universal or existential quantifiers which are restricted (""bounded"") to range only over the subtypes of a particular type. Bounded quantification is an interaction of parametric polymorphism with subtyping."
"44","Enterprise JavaBeans (EJB) is one of several Java APIs for modular construction of enterprise software. EJB is a server-side software component that encapsulates business logic of an application. An EJB web container provides a runtime environment for web related software components, including computer security, Java servlet lifecycle management, transaction processing, and other web services."
